{
  "agent_name": "aesthetic_agent",
  "score": 0,
  "pass": false,
  "problem_list": [
    "正式输入缺失：无原始浴缸/花洒素材与完整product_input；0为正式评价未完成占位，不是视觉分",
    "某某卫浴、历史宣传及活动句是未确认示例内容",
    "产品形态和花洒细节有重绘，无法核验真实商品"
  ],
  "modify_suggestion": [
    "真实任务使用商品原图与确认Logo合成并核验；保留第二版构图和自然空间关系",
    "确认真实品牌、卖点及活动日期后替换示例文案，再按同标准正式评分",
    "保持文字区边界及分行，进一步减少非必要英文与重复标题"
  ],
  "protected_content": [
    "浴缸与花洒真实身份（未完成核验）",
    "某某卫浴／XXX WEIYU（占位品牌）",
    "200年历史 某国百年厨卫经典（来源示例宣传，未核实）",
    "极致 · 经典",
    "活动时间：2024年7月20日（来源日期）",
    "来源水印及图片ID"
  ],
  "meta": {
    "judge_dimensions": [
      "构图与视觉平衡",
      "视觉层级",
      "配色与对比",
      "字体与排版",
      "风格与场景适配",
      "自然质感与完成度"
    ],
    "confidence": 0
  }
}
