{
  "agent_name": "aesthetic_agent",
  "score": 0,
  "pass": false,
  "problem_list": [
    "无法完成正式评价：缺少独立product_img与完整product_input；0为未完成评价占位值，并非视觉分",
    "最佳候选视觉诊断8.38/10，仍低于8.5；商品品牌和包装细字已有变化"
  ],
  "modify_suggestion": [
    "在真实任务中使用原始商品素材和确认文案核验身份，再完成正式评分；不要以旧海报中的生成商品替代母本",
    "下一轮以第二版为基础精修文图重心、材质与小字；避免第三版底部大色块抢主次；本测试已达3轮上限，未宣称通过"
  ],
  "protected_content": [
    "原始商品身份、包装与标签（本次无独立素材，保护未完成）",
    "全场满999立减69",
    "618狂欢！",
    "即刻开启",
    "活动时间：6.18—6.20",
    "原图Logo视觉形态（尚未核实）"
  ],
  "meta": {
    "judge_dimensions": [
      "构图与视觉平衡",
      "视觉层级",
      "配色与对比",
      "字体与排版",
      "风格与场景适配",
      "自然质感与完成度"
    ],
    "confidence": 0
  }
}
