{
  "agent_name": "aesthetic_agent",
  "score": 0,
  "pass": false,
  "problem_list": [
    "正式评价未完成：无独立商品母本与完整product_input；0为未完成占位，并非视觉分",
    "第5版视觉诊断8.58，但品牌和包装微字已有变化，内容保护不通过"
  ],
  "modify_suggestion": [
    "真实任务中用原始商品素材合成并精确排版标签，再核验商品身份",
    "保留第5版构图与光线方向，核验后重新六维评分；不得用视觉达标代替身份验收"
  ],
  "protected_content": [
    "商品主体与包装身份（当前未完成核验）",
    "原图Logo（含义与真伪未确认）",
    "618狂欢！",
    "即刻开启",
    "全场满999立减69",
    "活动时间：6.18—6.20"
  ],
  "meta": {
    "judge_dimensions": [
      "构图与视觉平衡",
      "视觉层级",
      "配色与对比",
      "字体与排版",
      "风格与场景适配",
      "自然质感与完成度"
    ],
    "confidence": 0
  }
}
