{
  "agent_name": "aesthetic_agent",
  "score": 6.7,
  "pass": false,
  "problem_list": [
    "[构图与视觉平衡/P1] 虚构演示：主体被大量无功能装饰包围，商品比例偏小。",
    "[视觉层级/P1] 虚构演示：立体大标题压过商品和核心信息。",
    "[风格与场景适配/P1] 虚构演示：太空装置与日常场景标签缺少关联。",
    "[自然质感与完成度/P1] 虚构演示：统一塑料高光与悬浮装饰造成不可信的材质。",
    "现有视觉方案需要整体重新设计，局部微调不足以解决主要问题"
  ],
  "modify_suggestion": [
    "以原始商品图作为主焦点，允许等比放大和移位，取消大型道具占位，以合理留白重建画面。",
    "重做字级与分区，以商品、核心卖点、价格形成清楚阅读路径，将标题作为辅助营销层。",
    "按scene_tags重新选择视觉背景，移除无功能科技装置，场景道具最多保留有解释作用的部分。",
    "采用单一主光，区分包装/金属/玻璃材质，增加合理接触阴影；原商品和标签用真实素材保留。",
    "重构方向：围绕商品及C组标签建立可信的商品广告；用原始素材做主角，不模仿旧科技促销模板；商品呈现：原商品图做主视觉，允许等比放大及重新定位，包装和标签不重绘；布局：重建商品区与独立信息区；核心卖点相邻分组，价格形成明确但不过度抢眼的行动节点；移除：无功能发光底座、无关器械、多余悬浮珍珠、膨胀立体文字；保护商品身份与输入事实，允许换背景、字体、配色及位置"
  ],
  "protected_content": [
    "商品主体：以product_img为身份依据，保护包装、标签、形状和比例",
    "卖点原文：卖点1",
    "卖点原文：卖点2",
    "价格文案：价格文案",
    "可确认的Logo及必要活动事实（如存在）：从原素材保留，不重绘"
  ],
  "meta": {
    "judge_dimensions": [
      "构图与视觉平衡",
      "视觉层级",
      "配色与对比",
      "字体与排版",
      "风格与场景适配",
      "自然质感与完成度"
    ],
    "confidence": 0.85
  }
}
