{
  "agent_name": "aesthetic_agent",
  "score": 0,
  "pass": false,
  "problem_list": [
    "缺少原始商品图与完整product_input，正式评价未完成；0是未评价占位值，不是视觉分",
    "第二版视觉诊断8.63，但瓶身橙色标记已改写，不能确认真实商品身份"
  ],
  "modify_suggestion": [
    "真实任务中使用原始瓶图和确认的标签素材合成，禁止重生成品牌标记，再完成内容核验和正式评分",
    "保留第二版的信息层级与夏日场景，进一步压低茶液/果肉高光并减少渲染式凝露"
  ],
  "protected_content": [
    "商品瓶型、包装标签与真实品牌标记（未完成核验）",
    "酸甜橙C",
    "0糖真过滤",
    "添加真果汁",
    "低卡轻负担",
    "橙C乌龙茶",
    "解锁你的夏日解渴公式"
  ],
  "meta": {
    "judge_dimensions": [
      "构图与视觉平衡",
      "视觉层级",
      "配色与对比",
      "字体与排版",
      "风格与场景适配",
      "自然质感与完成度"
    ],
    "confidence": 0
  }
}
